{"$defs":{"expr":{"oneOf":[{"additionalProperties":false,"properties":{"kind":{"const":"const"},"value":{"maximum":2147483647,"minimum":-2147483648,"type":"integer"}},"required":["kind","value"],"type":"object"},{"additionalProperties":false,"properties":{"kind":{"const":"bool"},"value":{"type":"boolean"}},"required":["kind","value"],"type":"object"},{"additionalProperties":false,"properties":{"id":{"maxLength":48,"minLength":1,"not":{"enum":["constructor","prototype","__proto__"]},"pattern":"^[A-Za-z][A-Za-z0-9_-]{0,47}$","type":"string"},"kind":{"enum":["var","param"]}},"required":["kind","id"],"type":"object"},{"additionalProperties":false,"properties":{"kind":{"const":"sensor"},"name":{"maxLength":80,"minLength":1,"type":"string"}},"required":["kind","name"],"type":"object"},{"additionalProperties":false,"properties":{"kind":{"const":"op"},"left":{"$ref":"#/$defs/expr"},"op":{"enum":["add","sub","mul","div","min","max"]},"right":{"$ref":"#/$defs/expr"}},"required":["kind","op","left","right"],"type":"object"},{"additionalProperties":false,"properties":{"kind":{"const":"compare"},"left":{"$ref":"#/$defs/expr"},"op":{"enum":["eq","ne","lt","lte","gt","gte"]},"right":{"$ref":"#/$defs/expr"}},"required":["kind","op","left","right"],"type":"object"},{"additionalProperties":false,"properties":{"kind":{"const":"clamp"},"max":{"$ref":"#/$defs/expr"},"min":{"$ref":"#/$defs/expr"},"value":{"$ref":"#/$defs/expr"}},"required":["kind","value","min","max"],"type":"object"},{"additionalProperties":false,"properties":{"args":{"items":{"$ref":"#/$defs/expr"},"maxItems":16,"minItems":1,"type":"array"},"kind":{"enum":["all","any"]}},"required":["kind","args"],"type":"object"},{"additionalProperties":false,"properties":{"kind":{"const":"not"},"value":{"$ref":"#/$defs/expr"}},"required":["kind","value"],"type":"object"}]}},"$id":"https://promptchien.invalid/schemas/v2/bot-definition.json","$schema":"https://json-schema.org/draft/2020-12/schema","additionalProperties":false,"properties":{"body":{"additionalProperties":false,"properties":{"grid":{"const":"square-12-v1"},"modules":{"items":{"additionalProperties":false,"properties":{"catalogId":{"maxLength":48,"minLength":1,"not":{"enum":["constructor","prototype","__proto__"]},"pattern":"^[A-Za-z][A-Za-z0-9_-]{0,47}$","type":"string"},"cell":{"additionalProperties":false,"properties":{"x":{"maximum":11,"minimum":0,"type":"integer"},"y":{"maximum":11,"minimum":0,"type":"integer"}},"required":["x","y"],"type":"object"},"id":{"maxLength":48,"minLength":1,"not":{"enum":["constructor","prototype","__proto__"]},"pattern":"^[A-Za-z][A-Za-z0-9_-]{0,47}$","type":"string"},"orientation":{"maximum":3,"minimum":0,"type":"integer"}},"required":["id","catalogId","cell","orientation"],"type":"object"},"maxItems":24,"minItems":1,"type":"array"}},"required":["grid","modules"],"type":"object"},"brain":{"additionalProperties":false,"properties":{"abiVersion":{"const":"2.0"},"initialState":{"maxLength":48,"minLength":1,"not":{"enum":["constructor","prototype","__proto__"]},"pattern":"^[A-Za-z][A-Za-z0-9_-]{0,47}$","type":"string"},"skills":{"items":{"additionalProperties":false,"properties":{"body":{"oneOf":[{"additionalProperties":false,"properties":{"intent":{"additionalProperties":false,"properties":{"modules":{"items":{"oneOf":[{"additionalProperties":false,"properties":{"action":{"const":"activate"},"aimOffset":{"$ref":"#/$defs/expr"},"moduleId":{"maxLength":48,"minLength":1,"not":{"enum":["constructor","prototype","__proto__"]},"pattern":"^[A-Za-z][A-Za-z0-9_-]{0,47}$","type":"string"},"priority":{"maximum":15,"minimum":0,"type":"integer"}},"required":["moduleId","action","aimOffset","priority"],"type":"object"},{"additionalProperties":false,"properties":{"action":{"enum":["shieldOn","shieldOff"]},"moduleId":{"maxLength":48,"minLength":1,"not":{"enum":["constructor","prototype","__proto__"]},"pattern":"^[A-Za-z][A-Za-z0-9_-]{0,47}$","type":"string"},"priority":{"maximum":15,"minimum":0,"type":"integer"}},"required":["moduleId","action","priority"],"type":"object"}]},"maxItems":3,"minItems":0,"type":"array"},"thrust":{"additionalProperties":false,"properties":{"forward":{"$ref":"#/$defs/expr"},"strafe":{"$ref":"#/$defs/expr"}},"required":["forward","strafe"],"type":"object"},"turn":{"$ref":"#/$defs/expr"}},"required":["thrust","turn","modules"],"type":"object"},"nextState":{"additionalProperties":false,"properties":{"parameter":{"maxLength":48,"minLength":1,"not":{"enum":["constructor","prototype","__proto__"]},"pattern":"^[A-Za-z][A-Za-z0-9_-]{0,47}$","type":"string"}},"required":["parameter"],"type":"object"},"set":{"items":{"additionalProperties":false,"properties":{"value":{"$ref":"#/$defs/expr"},"variable":{"maxLength":48,"minLength":1,"not":{"enum":["constructor","prototype","__proto__"]},"pattern":"^[A-Za-z][A-Za-z0-9_-]{0,47}$","type":"string"}},"required":["variable","value"],"type":"object"},"maxItems":64,"minItems":0,"type":"array"},"when":{"$ref":"#/$defs/expr"}},"required":["when","intent"],"type":"object"},{"additionalProperties":false,"properties":{"args":{"additionalProperties":{"oneOf":[{"$ref":"#/$defs/expr"},{"maxLength":48,"minLength":1,"not":{"enum":["constructor","prototype","__proto__"]},"pattern":"^[A-Za-z][A-Za-z0-9_-]{0,47}$","type":"string"}]},"maxProperties":16,"propertyNames":{"maxLength":48,"minLength":1,"not":{"enum":["constructor","prototype","__proto__"]},"pattern":"^[A-Za-z][A-Za-z0-9_-]{0,47}$","type":"string"},"type":"object"},"useSkill":{"maxLength":48,"minLength":1,"not":{"enum":["constructor","prototype","__proto__"]},"pattern":"^[A-Za-z][A-Za-z0-9_-]{0,47}$","type":"string"}},"required":["useSkill","args"],"type":"object"}]},"id":{"maxLength":48,"minLength":1,"not":{"enum":["constructor","prototype","__proto__"]},"pattern":"^[A-Za-z][A-Za-z0-9_-]{0,47}$","type":"string"},"parameters":{"items":{"additionalProperties":false,"properties":{"id":{"maxLength":48,"minLength":1,"not":{"enum":["constructor","prototype","__proto__"]},"pattern":"^[A-Za-z][A-Za-z0-9_-]{0,47}$","type":"string"},"type":{"enum":["int","bool","state"]}},"required":["id","type"],"type":"object"},"maxItems":16,"minItems":0,"type":"array"}},"required":["id","parameters","body"],"type":"object"},"maxItems":16,"minItems":0,"type":"array"},"states":{"items":{"additionalProperties":false,"properties":{"id":{"maxLength":48,"minLength":1,"not":{"enum":["constructor","prototype","__proto__"]},"pattern":"^[A-Za-z][A-Za-z0-9_-]{0,47}$","type":"string"},"rules":{"items":{"oneOf":[{"additionalProperties":false,"properties":{"id":{"maxLength":48,"minLength":1,"not":{"enum":["constructor","prototype","__proto__"]},"pattern":"^[A-Za-z][A-Za-z0-9_-]{0,47}$","type":"string"},"intent":{"additionalProperties":false,"properties":{"modules":{"items":{"oneOf":[{"additionalProperties":false,"properties":{"action":{"const":"activate"},"aimOffset":{"$ref":"#/$defs/expr"},"moduleId":{"maxLength":48,"minLength":1,"not":{"enum":["constructor","prototype","__proto__"]},"pattern":"^[A-Za-z][A-Za-z0-9_-]{0,47}$","type":"string"},"priority":{"maximum":15,"minimum":0,"type":"integer"}},"required":["moduleId","action","aimOffset","priority"],"type":"object"},{"additionalProperties":false,"properties":{"action":{"enum":["shieldOn","shieldOff"]},"moduleId":{"maxLength":48,"minLength":1,"not":{"enum":["constructor","prototype","__proto__"]},"pattern":"^[A-Za-z][A-Za-z0-9_-]{0,47}$","type":"string"},"priority":{"maximum":15,"minimum":0,"type":"integer"}},"required":["moduleId","action","priority"],"type":"object"}]},"maxItems":3,"minItems":0,"type":"array"},"thrust":{"additionalProperties":false,"properties":{"forward":{"$ref":"#/$defs/expr"},"strafe":{"$ref":"#/$defs/expr"}},"required":["forward","strafe"],"type":"object"},"turn":{"$ref":"#/$defs/expr"}},"required":["thrust","turn","modules"],"type":"object"},"nextState":{"maxLength":48,"minLength":1,"not":{"enum":["constructor","prototype","__proto__"]},"pattern":"^[A-Za-z][A-Za-z0-9_-]{0,47}$","type":"string"},"set":{"items":{"additionalProperties":false,"properties":{"value":{"$ref":"#/$defs/expr"},"variable":{"maxLength":48,"minLength":1,"not":{"enum":["constructor","prototype","__proto__"]},"pattern":"^[A-Za-z][A-Za-z0-9_-]{0,47}$","type":"string"}},"required":["variable","value"],"type":"object"},"maxItems":64,"minItems":0,"type":"array"},"when":{"$ref":"#/$defs/expr"}},"required":["id","when","intent"],"type":"object"},{"additionalProperties":false,"properties":{"args":{"additionalProperties":{"oneOf":[{"$ref":"#/$defs/expr"},{"maxLength":48,"minLength":1,"not":{"enum":["constructor","prototype","__proto__"]},"pattern":"^[A-Za-z][A-Za-z0-9_-]{0,47}$","type":"string"}]},"maxProperties":16,"propertyNames":{"maxLength":48,"minLength":1,"not":{"enum":["constructor","prototype","__proto__"]},"pattern":"^[A-Za-z][A-Za-z0-9_-]{0,47}$","type":"string"},"type":"object"},"id":{"maxLength":48,"minLength":1,"not":{"enum":["constructor","prototype","__proto__"]},"pattern":"^[A-Za-z][A-Za-z0-9_-]{0,47}$","type":"string"},"useSkill":{"maxLength":48,"minLength":1,"not":{"enum":["constructor","prototype","__proto__"]},"pattern":"^[A-Za-z][A-Za-z0-9_-]{0,47}$","type":"string"}},"required":["id","useSkill","args"],"type":"object"}]},"maxItems":32,"minItems":0,"type":"array"}},"required":["id","rules"],"type":"object"},"maxItems":32,"minItems":1,"type":"array"},"variables":{"items":{"oneOf":[{"additionalProperties":false,"properties":{"id":{"maxLength":48,"minLength":1,"not":{"enum":["constructor","prototype","__proto__"]},"pattern":"^[A-Za-z][A-Za-z0-9_-]{0,47}$","type":"string"},"initial":{"maximum":2147483647,"minimum":-2147483648,"type":"integer"},"type":{"const":"int"}},"required":["id","type","initial"],"type":"object"},{"additionalProperties":false,"properties":{"id":{"maxLength":48,"minLength":1,"not":{"enum":["constructor","prototype","__proto__"]},"pattern":"^[A-Za-z][A-Za-z0-9_-]{0,47}$","type":"string"},"initial":{"type":"boolean"},"type":{"const":"bool"}},"required":["id","type","initial"],"type":"object"}]},"maxItems":64,"minItems":0,"type":"array"}},"required":["abiVersion","initialState","variables","skills","states"],"type":"object"},"cosmetic":{"additionalProperties":false,"properties":{"paletteId":{"maxLength":48,"minLength":1,"not":{"enum":["constructor","prototype","__proto__"]},"pattern":"^[A-Za-z][A-Za-z0-9_-]{0,47}$","type":"string"},"skinId":{"maxLength":48,"minLength":1,"not":{"enum":["constructor","prototype","__proto__"]},"pattern":"^[A-Za-z][A-Za-z0-9_-]{0,47}$","type":"string"}},"required":["skinId","paletteId"],"type":"object"},"name":{"maxLength":64,"minLength":1,"type":"string"},"schemaVersion":{"const":"2.0"}},"required":["schemaVersion","name","body","brain","cosmetic"],"type":"object"}
