{"body":{"grid":"square-12-v1","modules":[{"catalogId":"core","cell":{"x":5,"y":5},"id":"coreMain","orientation":0},{"catalogId":"thruster","cell":{"x":4,"y":5},"id":"driveTop","orientation":0},{"catalogId":"thruster","cell":{"x":4,"y":6},"id":"driveBottom","orientation":0},{"catalogId":"blade","cell":{"x":7,"y":5},"id":"part0","orientation":0},{"catalogId":"armor","cell":{"x":6,"y":4},"id":"part2","orientation":0},{"catalogId":"shield","cell":{"x":7,"y":6},"id":"guard","orientation":0}]},"brain":{"abiVersion":"2.0","initialState":"hunt","skills":[],"states":[{"id":"hunt","rules":[{"id":"returnToRing","intent":{"modules":[],"thrust":{"forward":{"kind":"const","value":1000},"strafe":{"kind":"const","value":0}},"turn":{"kind":"clamp","max":{"kind":"const","value":1000},"min":{"kind":"const","value":-1000},"value":{"kind":"op","left":{"kind":"sensor","name":"arena.centerBearing"},"op":"mul","right":{"kind":"const","value":4}}}},"when":{"kind":"compare","left":{"kind":"sensor","name":"self.outsideRing"},"op":"eq","right":{"kind":"const","value":1}}},{"id":"coolAndControl","intent":{"modules":[{"action":"shieldOff","moduleId":"guard","priority":0}],"thrust":{"forward":{"kind":"const","value":700},"strafe":{"kind":"const","value":0}},"turn":{"kind":"clamp","max":{"kind":"const","value":1000},"min":{"kind":"const","value":-1000},"value":{"kind":"op","left":{"kind":"sensor","name":"arena.centerBearing"},"op":"mul","right":{"kind":"const","value":4}}}},"when":{"kind":"compare","left":{"kind":"sensor","name":"self.overheated"},"op":"eq","right":{"kind":"const","value":1}}},{"id":"blockTelegraph","intent":{"modules":[{"action":"shieldOn","moduleId":"guard","priority":0},{"action":"activate","aimOffset":{"kind":"const","value":0},"moduleId":"part0","priority":1}],"thrust":{"forward":{"kind":"const","value":500},"strafe":{"kind":"const","value":0}},"turn":{"kind":"clamp","max":{"kind":"const","value":1000},"min":{"kind":"const","value":-1000},"value":{"kind":"op","left":{"kind":"sensor","name":"enemy.bearing"},"op":"mul","right":{"kind":"const","value":4}}}},"when":{"kind":"compare","left":{"kind":"sensor","name":"enemy.telegraph"},"op":"eq","right":{"kind":"const","value":1}}},{"id":"engage","intent":{"modules":[{"action":"shieldOn","moduleId":"guard","priority":0},{"action":"activate","aimOffset":{"kind":"const","value":0},"moduleId":"part0","priority":1}],"thrust":{"forward":{"kind":"const","value":300},"strafe":{"kind":"const","value":0}},"turn":{"kind":"clamp","max":{"kind":"const","value":1000},"min":{"kind":"const","value":-1000},"value":{"kind":"op","left":{"kind":"sensor","name":"enemy.bearing"},"op":"mul","right":{"kind":"const","value":4}}}},"when":{"kind":"compare","left":{"kind":"sensor","name":"enemy.distance"},"op":"lt","right":{"kind":"const","value":5000}}},{"id":"takeCenter","intent":{"modules":[],"thrust":{"forward":{"kind":"const","value":1000},"strafe":{"kind":"const","value":0}},"turn":{"kind":"clamp","max":{"kind":"const","value":1000},"min":{"kind":"const","value":-1000},"value":{"kind":"op","left":{"kind":"sensor","name":"arena.centerBearing"},"op":"mul","right":{"kind":"const","value":4}}}},"when":{"kind":"bool","value":true}}]}],"variables":[]},"cosmetic":{"paletteId":"team-auto","skinId":"ceramic-default"},"name":"Bastion-lite","schemaVersion":"2.0"}
