{
  "schemaVersion": "2.0",
  "name": "Bastion-lite",
  "body": {
    "grid": "square-12-v1",
    "modules": [
      {
        "id": "coreMain",
        "catalogId": "core",
        "cell": {
          "x": 5,
          "y": 5
        },
        "orientation": 0
      },
      {
        "id": "driveTop",
        "catalogId": "thruster",
        "cell": {
          "x": 4,
          "y": 5
        },
        "orientation": 0
      },
      {
        "id": "driveBottom",
        "catalogId": "thruster",
        "cell": {
          "x": 4,
          "y": 6
        },
        "orientation": 0
      },
      {
        "id": "part0",
        "catalogId": "blade",
        "cell": {
          "x": 7,
          "y": 5
        },
        "orientation": 0
      },
      {
        "id": "part2",
        "catalogId": "armor",
        "cell": {
          "x": 6,
          "y": 4
        },
        "orientation": 0
      },
      {
        "id": "guard",
        "catalogId": "shield",
        "cell": {
          "x": 7,
          "y": 6
        },
        "orientation": 0
      }
    ]
  },
  "brain": {
    "abiVersion": "2.0",
    "initialState": "hunt",
    "variables": [],
    "skills": [],
    "states": [
      {
        "id": "hunt",
        "rules": [
          {
            "id": "returnToRing",
            "when": {
              "kind": "compare",
              "op": "eq",
              "left": {
                "kind": "sensor",
                "name": "self.outsideRing"
              },
              "right": {
                "kind": "const",
                "value": 1
              }
            },
            "intent": {
              "thrust": {
                "forward": {
                  "kind": "const",
                  "value": 1000
                },
                "strafe": {
                  "kind": "const",
                  "value": 0
                }
              },
              "turn": {
                "kind": "clamp",
                "value": {
                  "kind": "op",
                  "op": "mul",
                  "left": {
                    "kind": "sensor",
                    "name": "arena.centerBearing"
                  },
                  "right": {
                    "kind": "const",
                    "value": 4
                  }
                },
                "min": {
                  "kind": "const",
                  "value": -1000
                },
                "max": {
                  "kind": "const",
                  "value": 1000
                }
              },
              "modules": []
            }
          },
          {
            "id": "coolAndControl",
            "when": {
              "kind": "compare",
              "op": "eq",
              "left": {
                "kind": "sensor",
                "name": "self.overheated"
              },
              "right": {
                "kind": "const",
                "value": 1
              }
            },
            "intent": {
              "thrust": {
                "forward": {
                  "kind": "const",
                  "value": 700
                },
                "strafe": {
                  "kind": "const",
                  "value": 0
                }
              },
              "turn": {
                "kind": "clamp",
                "value": {
                  "kind": "op",
                  "op": "mul",
                  "left": {
                    "kind": "sensor",
                    "name": "arena.centerBearing"
                  },
                  "right": {
                    "kind": "const",
                    "value": 4
                  }
                },
                "min": {
                  "kind": "const",
                  "value": -1000
                },
                "max": {
                  "kind": "const",
                  "value": 1000
                }
              },
              "modules": [
                {
                  "moduleId": "guard",
                  "action": "shieldOff",
                  "priority": 0
                }
              ]
            }
          },
          {
            "id": "blockTelegraph",
            "when": {
              "kind": "compare",
              "op": "eq",
              "left": {
                "kind": "sensor",
                "name": "enemy.telegraph"
              },
              "right": {
                "kind": "const",
                "value": 1
              }
            },
            "intent": {
              "thrust": {
                "forward": {
                  "kind": "const",
                  "value": 500
                },
                "strafe": {
                  "kind": "const",
                  "value": 0
                }
              },
              "turn": {
                "kind": "clamp",
                "value": {
                  "kind": "op",
                  "op": "mul",
                  "left": {
                    "kind": "sensor",
                    "name": "enemy.bearing"
                  },
                  "right": {
                    "kind": "const",
                    "value": 4
                  }
                },
                "min": {
                  "kind": "const",
                  "value": -1000
                },
                "max": {
                  "kind": "const",
                  "value": 1000
                }
              },
              "modules": [
                {
                  "moduleId": "guard",
                  "action": "shieldOn",
                  "priority": 0
                },
                {
                  "moduleId": "part0",
                  "action": "activate",
                  "aimOffset": {
                    "kind": "const",
                    "value": 0
                  },
                  "priority": 1
                }
              ]
            }
          },
          {
            "id": "engage",
            "when": {
              "kind": "compare",
              "op": "lt",
              "left": {
                "kind": "sensor",
                "name": "enemy.distance"
              },
              "right": {
                "kind": "const",
                "value": 5000
              }
            },
            "intent": {
              "thrust": {
                "forward": {
                  "kind": "const",
                  "value": 300
                },
                "strafe": {
                  "kind": "const",
                  "value": 0
                }
              },
              "turn": {
                "kind": "clamp",
                "value": {
                  "kind": "op",
                  "op": "mul",
                  "left": {
                    "kind": "sensor",
                    "name": "enemy.bearing"
                  },
                  "right": {
                    "kind": "const",
                    "value": 4
                  }
                },
                "min": {
                  "kind": "const",
                  "value": -1000
                },
                "max": {
                  "kind": "const",
                  "value": 1000
                }
              },
              "modules": [
                {
                  "moduleId": "guard",
                  "action": "shieldOn",
                  "priority": 0
                },
                {
                  "moduleId": "part0",
                  "action": "activate",
                  "aimOffset": {
                    "kind": "const",
                    "value": 0
                  },
                  "priority": 1
                }
              ]
            }
          },
          {
            "id": "takeCenter",
            "when": {
              "kind": "bool",
              "value": true
            },
            "intent": {
              "thrust": {
                "forward": {
                  "kind": "const",
                  "value": 1000
                },
                "strafe": {
                  "kind": "const",
                  "value": 0
                }
              },
              "turn": {
                "kind": "clamp",
                "value": {
                  "kind": "op",
                  "op": "mul",
                  "left": {
                    "kind": "sensor",
                    "name": "arena.centerBearing"
                  },
                  "right": {
                    "kind": "const",
                    "value": 4
                  }
                },
                "min": {
                  "kind": "const",
                  "value": -1000
                },
                "max": {
                  "kind": "const",
                  "value": 1000
                }
              },
              "modules": []
            }
          }
        ]
      }
    ]
  },
  "cosmetic": {
    "skinId": "ceramic-default",
    "paletteId": "team-auto"
  }
}
